{
  "name": "26_labels_in_the_turn_language",
  "description": "A turn asked in Italian is offered its next steps in Italian. The actions travel to the reply writer as a key and the wording their author declared, and come back with the wording rewritten by the same call that writes the reply: three model calls, the same three a turn that offers nothing makes. An action no label came back for is still offered, in the words the catalog declares.",
  "level": 1,
  "provider_script": [
    {
      "purpose": "router classification",
      "expect_contains": "come sta il servizio di ricerca in staging",
      "response": {
        "kind": "new_task",
        "runbook_id": "runbook.service_health",
        "confidence": 0.93,
        "language": "it"
      }
    },
    {
      "purpose": "plan",
      "expect_contains": "come sta il servizio",
      "response": {
        "runbook_id": "runbook.service_health",
        "operations": [
          {
            "integration_id": "integration.container_runtime",
            "operation": "service.status",
            "payload": {
              "service": "search"
            },
            "write": false,
            "purpose": "read the state of the service"
          }
        ],
        "missing": [],
        "reply_intent": "report the state of search"
      }
    },
    {
      "purpose": "reply writing, with the wording of what is on offer",
      "expect_contains": "\"actions\": [{\"key\": \"runbook.service_restart\", \"label\": \"restart it\"}, {\"key\": \"runbook.deployment_rollback\", \"label\": \"roll it back\"}]",
      "response": {
        "reply": "Il servizio search e in esecuzione sulla versione 0.8.2 con 2 repliche.",
        "action_labels": {
          "runbook.service_restart": "riavvialo"
        }
      }
    }
  ],
  "turns": [
    {
      "user": "come sta il servizio di ricerca in staging",
      "expect": {
        "kind": "new_task",
        "contains": [
          "Il servizio search e in esecuzione",
          "- riavvialo",
          "- roll it back"
        ],
        "outcomes": [
          "read"
        ],
        "pending": null,
        "receipts": 0,
        "verification": null
      }
    }
  ]
}
